{
  "schema_version": "2",
  "recipe_id": "code-c-recipe-76529014f47945fc2916d0488115822b-linux",
  "recipe_sha256": "8d76acdd6f47268152139313b95c9c4057850f02156899db1dd4db32888d2c18",
  "freeze_status": "PRE_BUILD_FROZEN",
  "frozen_before_build": true,
  "source_identity": {
    "repository_id": "hed88798-dot/sbsb",
    "commit_sha": "76529014f47945fc2916d0488115822bc28d16c7",
    "tree_sha": "42c17d980331bcb39c0434e00e19875989f8853b",
    "submodule_state": "NONE",
    "untracked_build_input_count": 0
  },
  "product_source": {
    "repository_id": "hed88798-dot/sbsb",
    "source_commit_sha": "76529014f47945fc2916d0488115822bc28d16c7",
    "source_tree_sha": "42c17d980331bcb39c0434e00e19875989f8853b",
    "submodule_state": "NONE",
    "untracked_build_input_count": 0
  },
  "pyinstaller_spec": {
    "path": "sidecars/media-worker/media-worker.spec",
    "sha256": "35f7093a1247bd6cd9d71e83988807ab6bd80f3df72fee0481c850754b4dec5e"
  },
  "python_target": {
    "descriptor_id": "code-c-target-2b71b8be5739e2ef139ac4e6d3e15a6b",
    "descriptor_sha256": "2b71b8be5739e2ef139ac4e6d3e15a6bdd7dd1805484ce227dbfcf094a36da67"
  },
  "cpython_exact_artifact_sha256": "2b33ea85bdbb129c1c6bf2f2398fcfe7a5d52eb7730f7a67ae264aeafe7290b6",
  "inventory_approved_subject_set_sha256": "67b00a4e3b0858548895e857c85229b9c556b8766c350fced5b8d7501564ecf9",
  "toolchain_approved_subject_set_sha256": "692bb956be766425f10d0659b46d7a640669cc1d6be5972a353a77a80f2fcd8a",
  "exact_build_dependency_artifacts": [
    {
      "subject_id": "cpython-linux-3.13.15",
      "filename": "bin/python3.13",
      "sha256": "2b33ea85bdbb129c1c6bf2f2398fcfe7a5d52eb7730f7a67ae264aeafe7290b6",
      "role": "RUNTIME"
    },
    {
      "subject_id": "altgraph-0.17.5",
      "filename": "altgraph-0.17.5-py2.py3-none-any.whl",
      "sha256": "f3a22400bce1b0c701683820ac4f3b159cd301acab067c51c653e06961600597",
      "role": "BUILD_TOOLCHAIN"
    },
    {
      "subject_id": "click-8.5.0",
      "filename": "click-8.5.0-py3-none-any.whl",
      "sha256": "255bc9599cf7748b4b1a446ccc735421bd08a2ae529a8b88597d3de5664ee360",
      "role": "RUNTIME"
    },
    {
      "subject_id": "flatbuffers-25.12.19",
      "filename": "flatbuffers-25.12.19-py2.py3-none-any.whl",
      "sha256": "7634f50c427838bb021c2d66a3d1168e9d199b0607e6329399f04846d42e20b4",
      "role": "RUNTIME"
    },
    {
      "subject_id": "numpy-2.3.5",
      "filename": "numpy-2.3.5-cp313-cp313-manylinux_2_27_x86_64.manylinux_2_28_x86_64.whl",
      "sha256": "11e06aa0af8c0f05104d56450d6093ee639e15f24ecf62d417329d06e522e017",
      "role": "RUNTIME"
    },
    {
      "subject_id": "onnxruntime-1.29.0",
      "filename": "onnxruntime-1.29.0-cp313-cp313-manylinux_2_28_x86_64.whl",
      "sha256": "e2128f31f449e922c62dbe5d8b6b7b079f0bcaf2d56a102fa203cb6e5bb5ab19",
      "role": "RUNTIME"
    },
    {
      "subject_id": "opencv-python-headless-4.14.0.94",
      "filename": "opencv_python_headless-4.14.0.94-cp37-abi3-manylinux_2_28_x86_64.whl",
      "sha256": "211e581f5a4670acbbe08fff36a35e9946039d2eea28b80394632d036d1be527",
      "role": "RUNTIME"
    },
    {
      "subject_id": "packaging-26.3",
      "filename": "packaging-26.3-py3-none-any.whl",
      "sha256": "d7193f7c8e4e93f444fde0262bf90af30e16fa0ad0ad44cb553c87339b23cd1c",
      "role": "RUNTIME"
    },
    {
      "subject_id": "pillow-12.3.0",
      "filename": "pillow-12.3.0-cp313-cp313-manylinux_2_27_x86_64.manylinux_2_28_x86_64.whl",
      "sha256": "0847a763afefb695bc912d7c131e7e0632d4edc1d8698f58ddabec8e46b8b6d3",
      "role": "RUNTIME"
    },
    {
      "subject_id": "platformdirs-4.11.4",
      "filename": "platformdirs-4.11.4-py3-none-any.whl",
      "sha256": "e34ff91a24bcddc6d939b878bdf3f5c437c9c46fe9e212b1bf455fdf1ee57586",
      "role": "RUNTIME"
    },
    {
      "subject_id": "protobuf-7.36.0",
      "filename": "protobuf-7.36.0-cp310-abi3-manylinux2014_x86_64.whl",
      "sha256": "70f5ec8eb0da81a44360c0dc0beac99a0d78071d21956a7076bae8bd2051841b",
      "role": "RUNTIME"
    },
    {
      "subject_id": "pyinstaller-6.22.2",
      "filename": "pyinstaller-6.22.2-py3-none-manylinux2014_x86_64.whl",
      "sha256": "9622686ecc5d5fa492fe6cde29d47df9dd41138cff8177be9f901ca3260f2096",
      "role": "BUILD_TOOLCHAIN"
    },
    {
      "subject_id": "pyinstaller-hooks-contrib-2026.7",
      "filename": "pyinstaller_hooks_contrib-2026.7-py3-none-any.whl",
      "sha256": "24257a04c7a5a7a034cf28e39dcee20fbeeb9f043076729480f2e1b69904408a",
      "role": "BUILD_TOOLCHAIN"
    },
    {
      "subject_id": "scenedetect-headless-0.7.1",
      "filename": "scenedetect_headless-0.7.1-py3-none-any.whl",
      "sha256": "0594131cf2da278ac9f9442e1ce2a8fe6ccb25ab83a0899f349784e688d304c6",
      "role": "RUNTIME"
    },
    {
      "subject_id": "sentencepiece-0.2.1",
      "filename": "sentencepiece-0.2.1-cp313-cp313-manylinux_2_27_x86_64.manylinux_2_28_x86_64.whl",
      "sha256": "c7f0fd2f2693309e6628aeeb2e2faf6edd221134dfccac3308ca0de01f8dab47",
      "role": "RUNTIME"
    },
    {
      "subject_id": "setuptools-84.0.0",
      "filename": "setuptools-84.0.0-py3-none-any.whl",
      "sha256": "51a52592b3b99e102b609654876bd65f19f999935166d1352678931132b0c670",
      "role": "BUILD_TOOLCHAIN"
    },
    {
      "subject_id": "tqdm-4.70.0",
      "filename": "tqdm-4.70.0-py3-none-any.whl",
      "sha256": "7f585706bfddbdebf89daac705b2dfcc16890130727d3197ca62c732b4310953",
      "role": "RUNTIME"
    },
    {
      "subject_id": "pip-pip-26.2.1-py3-none-any.whl",
      "filename": "pip-26.2.1-py3-none-any.whl",
      "sha256": "71138adf1f4ca900cdb7d289c21b7494329f2332b6d85f0e1c42108c0384ed3e",
      "role": "BUILD_TOOLCHAIN"
    }
  ],
  "pyinstaller_artifact": {
    "subject_id": "pyinstaller-6.22.2",
    "filename": "pyinstaller-6.22.2-py3-none-manylinux2014_x86_64.whl",
    "sha256": "9622686ecc5d5fa492fe6cde29d47df9dd41138cff8177be9f901ca3260f2096"
  },
  "pyinstaller_hooks_contrib_artifact": {
    "subject_id": "pyinstaller-hooks-contrib-2026.7",
    "filename": "pyinstaller_hooks_contrib-2026.7-py3-none-any.whl",
    "sha256": "24257a04c7a5a7a034cf28e39dcee20fbeeb9f043076729480f2e1b69904408a"
  },
  "build_command": "locked-python",
  "command_arguments": [
    "-I",
    "-m",
    "PyInstaller",
    "--clean",
    "--noconfirm",
    "--workpath",
    "artifacts/python-supply-chain/pyinstaller-build/linux/work",
    "--distpath",
    "artifacts/python-supply-chain/pyinstaller-build/linux/dist",
    "sidecars/media-worker/media-worker.spec"
  ],
  "working_directory_semantics": "REPOSITORY_ROOT",
  "environment_variable_allowlist": [
    "CI",
    "GITHUB_REPOSITORY",
    "GITHUB_RUN_ID",
    "GITHUB_SHA",
    "RUNNER_ARCH",
    "RUNNER_OS"
  ],
  "environment_variable_values": {
    "CI": "true",
    "GITHUB_SHA": "76529014f47945fc2916d0488115822bc28d16c7",
    "GITHUB_RUN_ID": "33838635766",
    "GITHUB_REPOSITORY": "hed88798-dot/sbsb",
    "RUNNER_OS": "Linux",
    "RUNNER_ARCH": "X64"
  },
  "dependency_resolution_mode": "LOCKFILE_EXACT_NO_NEW_RESOLUTION",
  "network_policy": "DECLARED_READ_ONLY_ALLOWLIST",
  "sdist_build_policy": "FORBIDDEN",
  "unapproved_artifact_download_policy": "FORBIDDEN",
  "expected_output_layout": [
    "artifacts/python-supply-chain/pyinstaller-build/linux/dist/",
    "artifacts/python-supply-chain/pyinstaller-build/linux/work/"
  ]
}
