{
  "schema_version": "2",
  "recipe_id": "code-c-recipe-76529014f47945fc2916d0488115822b-windows",
  "recipe_sha256": "8f4062eb0c627718d8f74e6212591a6d18b738184e12a62c5fa9929e39062048",
  "freeze_status": "PRE_BUILD_FROZEN",
  "frozen_before_build": true,
  "source_identity": {
    "repository_id": "hed88798-dot/sbsb",
    "commit_sha": "76529014f47945fc2916d0488115822bc28d16c7",
    "tree_sha": "42c17d980331bcb39c0434e00e19875989f8853b",
    "submodule_state": "NONE",
    "untracked_build_input_count": 0
  },
  "product_source": {
    "repository_id": "hed88798-dot/sbsb",
    "source_commit_sha": "76529014f47945fc2916d0488115822bc28d16c7",
    "source_tree_sha": "42c17d980331bcb39c0434e00e19875989f8853b",
    "submodule_state": "NONE",
    "untracked_build_input_count": 0
  },
  "pyinstaller_spec": {
    "path": "sidecars/media-worker/media-worker.spec",
    "sha256": "1c12ea2d615bb7403e163b0615ca00bd48996adaf0ebb04ff522d9833c0ccb4a"
  },
  "python_target": {
    "descriptor_id": "code-c-target-713f76e0a170611b00700e3a9705a604",
    "descriptor_sha256": "713f76e0a170611b00700e3a9705a6046b0f0f5869836420b51e342e8233d418"
  },
  "cpython_exact_artifact_sha256": "edec09c4853aeae9ac36efb8c9f95b6b8e2fee65eee56d9767a8b7c69c574403",
  "inventory_approved_subject_set_sha256": "d5f9edb695628b8ed5f5ce3bf35473f2409788a96248f9f258e5308deca781c8",
  "toolchain_approved_subject_set_sha256": "5e224542011541d3411a71b33630180dd7f5e3c437e76fabcbd56d7bed9b1b81",
  "exact_build_dependency_artifacts": [
    {
      "subject_id": "cpython-windows-3.13.15",
      "filename": "python-3.13.15-amd64.exe",
      "sha256": "edec09c4853aeae9ac36efb8c9f95b6b8e2fee65eee56d9767a8b7c69c574403",
      "role": "RUNTIME"
    },
    {
      "subject_id": "altgraph-0.17.5",
      "filename": "altgraph-0.17.5-py2.py3-none-any.whl",
      "sha256": "f3a22400bce1b0c701683820ac4f3b159cd301acab067c51c653e06961600597",
      "role": "BUILD_TOOLCHAIN"
    },
    {
      "subject_id": "click-8.5.0",
      "filename": "click-8.5.0-py3-none-any.whl",
      "sha256": "255bc9599cf7748b4b1a446ccc735421bd08a2ae529a8b88597d3de5664ee360",
      "role": "RUNTIME"
    },
    {
      "subject_id": "colorama-0.4.6",
      "filename": "colorama-0.4.6-py2.py3-none-any.whl",
      "sha256": "4f1d9991f5acc0ca119f9d443620b77f9d6b33703e51011c16baf57afb285fc6",
      "role": "RUNTIME"
    },
    {
      "subject_id": "flatbuffers-25.12.19",
      "filename": "flatbuffers-25.12.19-py2.py3-none-any.whl",
      "sha256": "7634f50c427838bb021c2d66a3d1168e9d199b0607e6329399f04846d42e20b4",
      "role": "RUNTIME"
    },
    {
      "subject_id": "numpy-2.3.5",
      "filename": "numpy-2.3.5-cp313-cp313-win_amd64.whl",
      "sha256": "00dc4e846108a382c5869e77c6ed514394bdeb3403461d25a829711041217d5b",
      "role": "RUNTIME"
    },
    {
      "subject_id": "onnxruntime-1.29.0",
      "filename": "onnxruntime-1.29.0-cp313-cp313-win_amd64.whl",
      "sha256": "2945e1f82f81f27e88decea88c7861f45baea23818950d467bf3909aa303119e",
      "role": "RUNTIME"
    },
    {
      "subject_id": "opencv-python-headless-4.14.0.94",
      "filename": "opencv_python_headless-4.14.0.94-cp37-abi3-win_amd64.whl",
      "sha256": "cbed65415b8f6a9541c705afe3e64795840524d0ff3bc58f507826284a1dc64b",
      "role": "RUNTIME"
    },
    {
      "subject_id": "packaging-26.3",
      "filename": "packaging-26.3-py3-none-any.whl",
      "sha256": "d7193f7c8e4e93f444fde0262bf90af30e16fa0ad0ad44cb553c87339b23cd1c",
      "role": "RUNTIME"
    },
    {
      "subject_id": "pefile-2024.8.26",
      "filename": "pefile-2024.8.26-py3-none-any.whl",
      "sha256": "76f8b485dcd3b1bb8166f1128d395fa3d87af26360c2358fb75b80019b957c6f",
      "role": "BUILD_TOOLCHAIN"
    },
    {
      "subject_id": "pillow-12.3.0",
      "filename": "pillow-12.3.0-cp313-cp313-win_amd64.whl",
      "sha256": "1cca606cd25738df4ed873d5ad46bbdb3d83b5cbca291f6b4ff13a4df6b0bbe8",
      "role": "RUNTIME"
    },
    {
      "subject_id": "platformdirs-4.11.4",
      "filename": "platformdirs-4.11.4-py3-none-any.whl",
      "sha256": "e34ff91a24bcddc6d939b878bdf3f5c437c9c46fe9e212b1bf455fdf1ee57586",
      "role": "RUNTIME"
    },
    {
      "subject_id": "protobuf-7.36.0",
      "filename": "protobuf-7.36.0-cp310-abi3-win_amd64.whl",
      "sha256": "1781cc1de61249b750848029bca452c0a8b7e990080316b9bbc2518b2117b488",
      "role": "RUNTIME"
    },
    {
      "subject_id": "pyinstaller-6.22.2",
      "filename": "pyinstaller-6.22.2-py3-none-win_amd64.whl",
      "sha256": "9b990fa6bbe143572f06644a984ad0d7aa2e2ccc6929d4916031343a5888e9a7",
      "role": "BUILD_TOOLCHAIN"
    },
    {
      "subject_id": "pyinstaller-hooks-contrib-2026.7",
      "filename": "pyinstaller_hooks_contrib-2026.7-py3-none-any.whl",
      "sha256": "24257a04c7a5a7a034cf28e39dcee20fbeeb9f043076729480f2e1b69904408a",
      "role": "BUILD_TOOLCHAIN"
    },
    {
      "subject_id": "pywin32-ctypes-0.2.3",
      "filename": "pywin32_ctypes-0.2.3-py3-none-any.whl",
      "sha256": "8a1513379d709975552d202d942d9837758905c8d01eb82b8bcc30918929e7b8",
      "role": "BUILD_TOOLCHAIN"
    },
    {
      "subject_id": "scenedetect-headless-0.7.1",
      "filename": "scenedetect_headless-0.7.1-py3-none-any.whl",
      "sha256": "0594131cf2da278ac9f9442e1ce2a8fe6ccb25ab83a0899f349784e688d304c6",
      "role": "RUNTIME"
    },
    {
      "subject_id": "sentencepiece-0.2.1",
      "filename": "sentencepiece-0.2.1-cp313-cp313-win_amd64.whl",
      "sha256": "10ed3dab2044c47f7a2e7b4969b0c430420cdd45735d78c8f853191fa0e3148b",
      "role": "RUNTIME"
    },
    {
      "subject_id": "setuptools-84.0.0",
      "filename": "setuptools-84.0.0-py3-none-any.whl",
      "sha256": "51a52592b3b99e102b609654876bd65f19f999935166d1352678931132b0c670",
      "role": "BUILD_TOOLCHAIN"
    },
    {
      "subject_id": "tqdm-4.70.0",
      "filename": "tqdm-4.70.0-py3-none-any.whl",
      "sha256": "7f585706bfddbdebf89daac705b2dfcc16890130727d3197ca62c732b4310953",
      "role": "RUNTIME"
    },
    {
      "subject_id": "pip-pip-26.2.1-py3-none-any.whl",
      "filename": "pip-26.2.1-py3-none-any.whl",
      "sha256": "71138adf1f4ca900cdb7d289c21b7494329f2332b6d85f0e1c42108c0384ed3e",
      "role": "BUILD_TOOLCHAIN"
    }
  ],
  "pyinstaller_artifact": {
    "subject_id": "pyinstaller-6.22.2",
    "filename": "pyinstaller-6.22.2-py3-none-win_amd64.whl",
    "sha256": "9b990fa6bbe143572f06644a984ad0d7aa2e2ccc6929d4916031343a5888e9a7"
  },
  "pyinstaller_hooks_contrib_artifact": {
    "subject_id": "pyinstaller-hooks-contrib-2026.7",
    "filename": "pyinstaller_hooks_contrib-2026.7-py3-none-any.whl",
    "sha256": "24257a04c7a5a7a034cf28e39dcee20fbeeb9f043076729480f2e1b69904408a"
  },
  "build_command": "locked-python",
  "command_arguments": [
    "-I",
    "tools/code-c-python-supply-chain/run_hermetic_pyinstaller.py",
    "--manifest",
    "artifacts/python-supply-chain/pyinstaller-build/windows/build-environment-manifest.json",
    "--build-context",
    "artifacts/python-supply-chain/pyinstaller-build/windows/build-context.json",
    "--build-log",
    "artifacts/python-supply-chain/pyinstaller-build/windows/raw/pyinstaller-build.log"
  ],
  "working_directory_semantics": "REPOSITORY_ROOT",
  "environment_variable_allowlist": [
    "CI",
    "GITHUB_REPOSITORY",
    "GITHUB_RUN_ID",
    "GITHUB_SHA",
    "RUNNER_ARCH",
    "RUNNER_OS"
  ],
  "environment_variable_values": {
    "CI": "true",
    "GITHUB_SHA": "76529014f47945fc2916d0488115822bc28d16c7",
    "GITHUB_RUN_ID": "33838635766",
    "GITHUB_REPOSITORY": "hed88798-dot/sbsb",
    "RUNNER_OS": "Windows",
    "RUNNER_ARCH": "X64"
  },
  "dependency_resolution_mode": "LOCKFILE_EXACT_NO_NEW_RESOLUTION",
  "network_policy": "DECLARED_READ_ONLY_ALLOWLIST",
  "sdist_build_policy": "FORBIDDEN",
  "unapproved_artifact_download_policy": "FORBIDDEN",
  "expected_output_layout": [
    "artifacts/python-supply-chain/pyinstaller-build/windows/dist/",
    "artifacts/python-supply-chain/pyinstaller-build/windows/work/"
  ]
}
